{
  "$schema": "https://crossforge.dev/schemas/rpm-plan.schema.json",
  "schema_version": 1,
  "kind": "rpm-plan",
  "identity": {
    "name": "qt-target-el8-aarch64",
    "role": "qt-target",
    "distribution": "rocky",
    "release": "8.10",
    "baseline": "el8",
    "arch": "aarch64",
    "target_triple": "aarch64-unknown-linux-gnu"
  },
  "base": {
    "mode": "lock",
    "parent_lock": "locks/sysroot-el8-aarch64.json",
    "parent_sha256": "70436d94443b019fbe61237bf93b8bb457927f3de09429e6ef7f37598b482b67"
  },
  "repositories": [
    {"id": "baseos", "baseurl": "https://download.rockylinux.org/pub/rocky/8.10/BaseOS/aarch64/os/"},
    {"id": "appstream", "baseurl": "https://download.rockylinux.org/pub/rocky/8.10/AppStream/aarch64/os/"},
    {"id": "powertools", "baseurl": "https://download.rockylinux.org/pub/rocky/8.10/PowerTools/aarch64/os/"}
  ],
  "solver_policy": {
    "allowed_arches": ["aarch64", "noarch"],
    "install_weak_deps": false,
    "best": true,
    "strict": true,
    "allow_erasing": false,
    "module_platform_id": "platform:el8",
    "enabled_modules": []
  },
  "roots": [
    {"name": "alsa-lib-devel", "arch": "target", "purpose": "qt-target"},
    {"name": "at-spi2-core-devel", "arch": "target", "purpose": "qt-target"},
    {"name": "cups-devel", "arch": "target", "purpose": "qt-target"},
    {"name": "dbus-devel", "arch": "target", "purpose": "qt-target"},
    {"name": "expat-devel", "arch": "target", "purpose": "qt-target"},
    {"name": "fontconfig-devel", "arch": "target", "purpose": "qt-target"},
    {"name": "freetype-devel", "arch": "target", "purpose": "qt-target"},
    {"name": "glib2-devel", "arch": "target", "purpose": "qt-target"},
    {"name": "libICE-devel", "arch": "target", "purpose": "qt-target"},
    {"name": "libSM-devel", "arch": "target", "purpose": "qt-target"},
    {"name": "libX11-devel", "arch": "target", "purpose": "qt-target"},
    {"name": "libX11-xcb", "arch": "target", "purpose": "qt-target"},
    {"name": "libXcomposite-devel", "arch": "target", "purpose": "qt-target"},
    {"name": "libXcursor-devel", "arch": "target", "purpose": "qt-target"},
    {"name": "libXdamage-devel", "arch": "target", "purpose": "qt-target"},
    {"name": "libXext-devel", "arch": "target", "purpose": "qt-target"},
    {"name": "libXfixes-devel", "arch": "target", "purpose": "qt-target"},
    {"name": "libXi-devel", "arch": "target", "purpose": "qt-target"},
    {"name": "libXrandr-devel", "arch": "target", "purpose": "qt-target"},
    {"name": "libXrender-devel", "arch": "target", "purpose": "qt-target"},
    {"name": "libXtst-devel", "arch": "target", "purpose": "qt-target"},
    {"name": "libdrm-devel", "arch": "target", "purpose": "qt-target"},
    {"name": "libinput-devel", "arch": "target", "purpose": "qt-target"},
    {"name": "libjpeg-turbo-devel", "arch": "target", "purpose": "qt-target"},
    {"name": "libpng-devel", "arch": "target", "purpose": "qt-target"},
    {"name": "libxcb-devel", "arch": "target", "purpose": "qt-target"},
    {"name": "libxkbcommon-devel", "arch": "target", "purpose": "qt-target"},
    {"name": "libxkbcommon-x11-devel", "arch": "target", "purpose": "qt-target"},
    {"name": "libxkbfile-devel", "arch": "target", "purpose": "qt-target"},
    {"name": "libxshmfence-devel", "arch": "target", "purpose": "qt-target"},
    {"name": "mesa-libEGL-devel", "arch": "target", "purpose": "qt-target"},
    {"name": "mesa-libGL-devel", "arch": "target", "purpose": "qt-target"},
    {"name": "mesa-libgbm-devel", "arch": "target", "purpose": "qt-target"},
    {"name": "nss-devel", "arch": "target", "purpose": "qt-target"},
    {"name": "openssl-devel", "arch": "target", "purpose": "qt-target"},
    {"name": "pciutils-devel", "arch": "target", "purpose": "qt-target"},
    {"name": "pulseaudio-libs-devel", "arch": "target", "purpose": "qt-target"},
    {"name": "sqlite-devel", "arch": "target", "purpose": "qt-target"},
    {"name": "systemd-devel", "arch": "target", "purpose": "qt-target"},
    {"name": "wayland-devel", "arch": "target", "purpose": "qt-target"},
    {"name": "wayland-protocols-devel", "arch": "noarch", "purpose": "qt-target"},
    {"name": "xcb-util-devel", "arch": "target", "purpose": "qt-target"},
    {"name": "xcb-util-image-devel", "arch": "target", "purpose": "qt-target"},
    {"name": "xcb-util-keysyms-devel", "arch": "target", "purpose": "qt-target"},
    {"name": "xcb-util-renderutil-devel", "arch": "target", "purpose": "qt-target"},
    {"name": "xcb-util-wm-devel", "arch": "target", "purpose": "qt-target"},
    {"name": "xorg-x11-proto-devel", "arch": "noarch", "purpose": "qt-target"},
    {"name": "zlib-devel", "arch": "target", "purpose": "qt-target"}
  ]
}
